{"algorithm":"Ed25519","attestation_digest":"sha256:47938543d3510e6d4c4068d7f0a476aa40483bba989d41c91c366f3590942776","schema":"chimera-capture-attestation/v1","signature":"6b45f013d7283fb9310a3378f77d4de4d0d3a8f5dab7102a984be2540853692af21b2e0fe0b2ff91d13ecefe550139e84a8b55e768a24ef20c55b855928af205","statement":{"invocation_id":"bd23dca5-b57c-4b0a-9382-95da643751b8","key_id":"sha256:21fe31dfa154a261626bf854046fd2271b7bed4b6abe45aa58877ef47f9721b9","public_key":"d75a980182b10ab7d54bfed3c964073a0ee172f3daa62325af021a68f707511a","receipt_digest":"sha256:ad8ca4df8e73093232f1cd7302ed255287d9383a56e8ad55e52a768e7491d5a2","role":"CAPTURE_REVIEWER","schema":"chimera-capture-statement/v1","scope":"RECORDED_BYTES_MATCH_EXTERNALLY_PINNED_RECEIPT_ONLY","signer_id":"test-vector-reviewer"}}
